Current Average Wait Time: one to two weeks|wip|delayed|done|
Workshop Job Reference Number|Last Updated|Repair Brief|Current Progress|Status
H7483|2026-05-19|Bulk repair; see separate sheet|See separate sheet|delayed
H7532|2026-06-15|Restring and setup with much heavier gauge strings|Cleaned, polished frets and oiled fretboard. Restrung, rebalanced tremolo, widened nut slots. Tightened loose strap button and output jack. Seting up...|wip
H7494|2026-06-15|Restore old violin for display cabinet|Applied peg paste to stuck tuners, cleaned neck. Cleaning body...|wip
H7533|2026-06-16|Fix output jack, restring and setup|Tightened output jack, polished frets and oiled fretboard|wip
H7526|2026-06-15|Swap pickup, fix selector switch, install new tuners, restring and setup|Swapped out pickup, fixed selector switch, installed new tuners (widened tuner holes). Cleaned, polished frets. |wip